{
  "catalogPurpose": "Foundation incubator package catalog and lifecycle model. It is descriptive and is not release or installation approval.",
  "products": [
    {
      "buildModel": "TypeScript build to dist/src; tests execute compiled dist",
      "displayName": "ChronoCompact",
      "extensionEntries": [
        {
          "path": "./dist/src/pi-extension.js",
          "entryKind": "build-entry",
          "existsInSource": false
        }
      ],
      "externalCommands": [
        "Node.js",
        "current Pi",
        "benchmark reads a regular .jsonl fixture",
        "no other external command documented"
      ],
      "id": "chrono-compact",
      "installationRecommended": false,
      "lifecycle": {
        "reason": "its current product scope and failure domain need decomposition.",
        "status": "quarantined"
      },
      "lockfile": {
        "path": "packages/chrono-compact/package-lock.json",
        "scope": "package"
      },
      "nextGate": {
        "action": "its current product scope and failure domain need decomposition.",
        "status": "quarantined"
      },
      "nodeRequirement": ">=20",
      "operatingSystemBoundary": "Node.js 20 or later; editable-memory lock recovery uses Linux /proc process identity and fails closed on platforms without that identity; no broader cross-platform production claim",
      "piPeerRangeOrPackageModel": {
        "packageModel": "published package with compiled dist entry and CLI; Pi extension package",
        "peerDependencies": [
          "@earendil-works/pi-ai:* (optional)",
          "@earendil-works/pi-coding-agent:* (optional)",
          "typebox:* (optional)"
        ]
      },
      "primaryPackage": "pi-chrono-compact",
      "publicationAllowed": false,
      "purpose": "Progressive chronological event compaction for long-running Pi sessions.",
      "releaseUnitIds": [
        "pi-chrono-compact"
      ],
      "sourceDirectory": "packages/chrono-compact",
      "stable": false,
      "validationCommands": {
        "clean": "rm -rf dist",
        "check": "tsc -p tsconfig.json --noEmit",
        "build": "tsc -p tsconfig.json",
        "test": "npm run build && node --test dist/test/*.test.js",
        "demo": "npm run build && node dist/src/cli.js compact examples/synthetic-session.jsonl --target 2500",
        "benchmark": "npm run build && node scripts/benchmark-v2.mjs",
        "prepack": "npm test"
      },
      "peerDependencies": {
        "@earendil-works/pi-ai": "*",
        "@earendil-works/pi-coding-agent": "*",
        "typebox": "*"
      },
      "peerDependenciesMeta": {
        "@earendil-works/pi-ai": {
          "optional": true
        },
        "@earendil-works/pi-coding-agent": {
          "optional": true
        },
        "typebox": {
          "optional": true
        }
      },
      "dependencies": {},
      "filesBoundary": [
        "dist/src",
        "README.md",
        "BUILD_REPORT.md",
        "LICENSE",
        "docs",
        "examples"
      ],
      "developmentPiVersion": "^0.83.0",
      "private": false
    },
    {
      "buildModel": "Source TypeScript loaded directly; tests use tsx; no build script",
      "displayName": "Grounded Tools",
      "extensionEntries": [
        {
          "path": "./packages/files/index.ts",
          "entryKind": "source-file",
          "existsInSource": true
        },
        {
          "path": "./packages/process/index.ts",
          "entryKind": "source-file",
          "existsInSource": true
        },
        {
          "path": "./packages/lsp/index.ts",
          "entryKind": "source-file",
          "existsInSource": true
        },
        {
          "path": "./packages/dialog/index.ts",
          "entryKind": "source-file",
          "existsInSource": true
        },
        {
          "path": "./packages/tasks/index.ts",
          "entryKind": "source-file",
          "existsInSource": true
        },
        {
          "path": "./packages/notes/index.ts",
          "entryKind": "source-file",
          "existsInSource": true
        },
        {
          "path": "./packages/workplan/index.ts",
          "entryKind": "source-file",
          "existsInSource": true
        }
      ],
      "externalCommands": [
        "rg",
        "fd",
        "Python 3 for PTY",
        "pdfinfo and pdftotext for PDF mode",
        "configured language servers: typescript-language-server, pyright-langserver, gopls, rust-analyzer, clangd"
      ],
      "id": "grounded-tools",
      "installationRecommended": false,
      "lifecycle": {
        "reason": "it has a broad privileged tool surface.",
        "status": "experimental"
      },
      "lockfile": {
        "path": "packages/grounded-tools/package-lock.json",
        "scope": "package"
      },
      "nextGate": {
        "action": "it has a broad privileged tool surface.",
        "status": "experimental"
      },
      "nodeRequirement": ">=22",
      "operatingSystemBoundary": "Current POSIX Node.js 22+; external executable availability is environment-dependent",
      "piPeerRangeOrPackageModel": {
        "packageModel": "umbrella package plus independently publishable workspace units",
        "peerDependencies": [
          "@earendil-works/pi-ai:*",
          "@earendil-works/pi-coding-agent:*",
          "@earendil-works/pi-tui:*",
          "typebox:*",
          "@grounded/pi-core dependency"
        ]
      },
      "primaryPackage": "pi-grounded-tools",
      "publicationAllowed": false,
      "purpose": "Full-fidelity, evidence-first tools and coordination extensions for Pi.",
      "releaseUnitIds": [
        "pi-grounded-tools",
        "grounded-pi-core",
        "grounded-pi-dialog",
        "grounded-pi-files",
        "grounded-pi-lsp",
        "grounded-pi-notes",
        "grounded-pi-process",
        "grounded-pi-tasks",
        "grounded-pi-workplan"
      ],
      "sourceDirectory": "packages/grounded-tools",
      "stable": false,
      "validationCommands": {
        "check": "npm run typecheck && npm test && npm run pack:check",
        "typecheck": "tsc --noEmit",
        "test": "node --import tsx --test tests/*.test.ts",
        "pack:check": "npm pack --dry-run --json > /dev/null && npm pack --workspaces --dry-run --json > /dev/null"
      },
      "peerDependencies": {
        "@earendil-works/pi-ai": "*",
        "@earendil-works/pi-coding-agent": "*",
        "@earendil-works/pi-tui": "*",
        "typebox": "*"
      },
      "peerDependenciesMeta": {},
      "dependencies": {
        "@grounded/pi-core": "0.1.0"
      },
      "filesBoundary": [
        "packages",
        "docs",
        "README.md",
        "LICENSE"
      ],
      "developmentPiVersion": "0.83.0",
      "private": false
    },
    {
      "buildModel": "Direct TypeScript source; no build step",
      "displayName": "Progressive Tools",
      "extensionEntries": [
        {
          "path": "./extensions/index.ts",
          "entryKind": "source-file",
          "existsInSource": true
        }
      ],
      "externalCommands": [
        "Pi CLI for install/run",
        "no other external command"
      ],
      "id": "progressive-tools",
      "installationRecommended": false,
      "lifecycle": {
        "reason": "it has not completed the same public stabilization and deployment-boundary review.",
        "status": "experimental"
      },
      "lockfile": {
        "path": "packages/progressive-tools/package-lock.json",
        "scope": "package"
      },
      "nextGate": {
        "action": "it has not completed the same public stabilization and deployment-boundary review.",
        "status": "experimental"
      },
      "nodeRequirement": ">=22.19.0",
      "operatingSystemBoundary": "Node.js 22.19+; Pi 0.83.x–0.84.x",
      "piPeerRangeOrPackageModel": {
        "packageModel": "package-only Pi extension",
        "peerDependencies": [
          "@earendil-works/pi-coding-agent:>=0.83.0 <0.85.0",
          "@earendil-works/pi-tui:>=0.83.0 <0.85.0",
          "typebox:>=1.3.0 <2.0.0"
        ]
      },
      "primaryPackage": "pi-progressive-tools",
      "publicationAllowed": false,
      "purpose": "Conservative progressive discovery and lazy activation for Pi tools.",
      "releaseUnitIds": [
        "pi-progressive-tools"
      ],
      "sourceDirectory": "packages/progressive-tools",
      "stable": false,
      "validationCommands": {
        "test": "node --experimental-strip-types --test tests/*.test.ts",
        "syntax": "node --experimental-strip-types --check extensions/index.ts",
        "prepack": "npm run syntax && npm test"
      },
      "peerDependencies": {
        "@earendil-works/pi-coding-agent": ">=0.83.0 <0.85.0",
        "@earendil-works/pi-tui": ">=0.83.0 <0.85.0",
        "typebox": ">=1.3.0 <2.0.0"
      },
      "peerDependenciesMeta": {},
      "dependencies": {},
      "filesBoundary": [
        "extensions",
        "tests",
        "docs",
        "examples",
        "CHANGELOG.md",
        "LICENSE",
        "MANIFEST.sha256",
        "README.md",
        "progressive-tools.config.json",
        "progressive-tools.schema.json"
      ],
      "developmentPiVersion": "0.84.1",
      "private": false
    },
    {
      "buildModel": "TypeScript build to dist; smoke validates packed output",
      "displayName": "Files UI",
      "extensionEntries": [
        {
          "path": "./extensions",
          "entryKind": "source-directory",
          "existsInSource": true
        }
      ],
      "externalCommands": [
        "Node.js filesystem APIs",
        "no shell command required by package behavior"
      ],
      "id": "files-ui",
      "installationRecommended": false,
      "lifecycle": {
        "reason": "it is the intended first stabilization pilot.",
        "status": "candidate"
      },
      "lockfile": {
        "path": "packages/files-ui/package-lock.json",
        "scope": "package"
      },